1281,OXFOCOL2,Oxford at Colborne WB - #1281,42.9978860,-81.2453380,"Rt4, Rt17, Rt104, ",-,Wood Hydro / Light Pole,-,-,-,No
1285,OXFOELI1,Oxford at Elizabeth EB - #1285,43.0008330,-81.2348110,"Rt4, Rt17, Rt104, ",-,Wood Hydro / Light Pole,-,-,-,No
1286,OXFOELI2,Oxford at Elizabeth WB - #1286,43.0010400,-81.2343280,"Rt4, Rt17, Rt104, ",-,U-channel (with other signage),-,-,-,No
1287,OXFOELL1,Oxford at Elliott EB - #1287,43.0015990,-81.2321000,"Rt4, Rt17, Rt104, ",-,Wood Hydro / Light Pole,-,-,-,No
1288,OXFOELL2,Oxford at Elliott WB - #1288,43.0018250,-81.2316620,"Rt4, Rt17, Rt104, ",-,U-channel (stop specific),-,-,-,No
1289,OXFOEMPI,Oxford at Empire EB - #1289,43.0069640,-81.2137680,"Rt4, Rt17, Rt104, ",-,U-channel (stop specific),-,-,-,No
1290,OXFOFERN,Oxford at Fernely WB - #1290,42.9918420,-81.2656300,"Rt17, Rt91, ",-,U-channel (stop specific),4 x 8 Non-Ad,Black Ad Bench ,Large Can (on Ground) ,No
1291,OXFOFID1,Oxford at Fiddlers Green EB - #1291,42.9763090,-81.3181790,"Rt17, ",-,Wood Hydro / Light Pole,4 x 8 Non-Ad,Black Ad Bench ,Large Can (on Ground) ,No
1292,OXFOFID2,Oxford at Fiddlers Green WB - #1292,42.9766060,-81.3177310,"Rt17, ",-,U-channel (stop specific),-,Black Ad Bench ,-,No
1294,OXFOFRE1,Oxford at Freele EB - #1294,42.9784160,-81.3109410,"Rt17, ",-,Wood Hydro / Light Pole,-,Black Ad Bench ,-,No
1295,OXFOFRE2,Oxford at Freele WB - #1295,42.9786370,-81.3107310,"Rt17, ",-,U-channel (stop specific),-,Black Ad Bench ,-,No
1296,OXFOGAM1,Oxford at Gammage EB - #1296,43.0025910,-81.2287230,"Rt4, Rt17, Rt91, Rt104, ",-,Wood Hydro / Light Pole,4 x 8 Ad,-,Large Can (on Ground) ,No
1297,OXFOGAM2,Oxford at Gammage WB - #1297,43.0028990,-81.2280150,"Rt4, Rt17, Rt91, Rt104, ",-,U-channel (with other signage),-,Black Ad Bench ,Large Can (on Ground) ,No
1298,OXFOGEO1,Oxford at St. George EB - #1298,42.9947430,-81.2555760,"Rt17, ",-,Metal Hydro / Light Pole,-,-,Large Can (on Ground) ,No
1299,OXFOGEO2,Oxford at St. George WB - #1299,42.9947580,-81.2559440,"Rt17, ",-,Wood Hydro / Light Pole,-,Black Ad Bench ,-,No
1300,OXFOGM1,General Dynamics Gate 4 - #1300,43.0188800,-81.1722060,"Rt36, ",-,U-channel (with other signage),-,-,-,Yes
1301,OXFOGM2,Oxford at General Dynamics Main Gate - #1301,43.0194250,-81.1707030,"Rt36, ",-,Wood Hydro / Light Pole,-,-,-,No
1302,OXFOGM3,2035 Oxford - #1302,43.0198680,-81.1687200,"Rt36, ",-,U-channel (with other signage),-,-,-,No
1303,OXFOGRAC,Oxford & Grace St WB - #1303,42.9926170,-81.2629110,"Rt17, ",-,Concrete Hydro / Light Pole,-,Black Ad Bench ,-,No
1304,OXFOGUI1,Oxford at Guildwood Gate EB - #1304,42.9774500,-81.3141250,"Rt17, ",-,U-channel (stop specific),4 x 8 Non-Ad,Black Ad Bench ,-,Yes
1305,OXFOGUI2,Oxford at Guildwood Blvd WB - #1305,42.9800490,-81.3058830,"Rt17, ",-,Wood Hydro / Light Pole,4 x 8 Ad,-,-,No
1306,OXFOGUI3,Oxford at Guildwood Gate WB - #1306,42.9775150,-81.3147310,"Rt17, ",-,Wood Hydro / Light Pole,-,Black Ad Bench ,-,No
1307,OXFOHIG1,Oxbury Centre - #1307,43.0078890,-81.2104250,"Rt4, Rt17, Rt20, Rt104, ",-,TBD Following Construction,4 x 8 Ad,-,-,No
1308,OXFOHIG2,Oxford at Highbury WB - #1308,43.0080708,-81.2104396,"Rt4, Rt17, Rt20, Rt91, Rt104, ",-,TBD Following Construction,-,-,-,No
1309,OXFOHIG3,Oxford at Highbury EB - #1309,43.0084683,-81.2083490,"Rt4, Rt17, Rt20, Rt91, Rt104, ",-,TBD Following Construction,4 x 12 Ad,-,-,Yes
1310,OXFOHIG4,John Paul Secondary School - #1310,43.0089830,-81.2073000,"Rt4, Rt17, Rt20, Rt104, ",-,Metal Hydro / Light Pole,-,Black Ad Bench ,-,No
1311,OXFOHYD1,Oxford at Hyde Park EB - #1311,42.9755910,-81.3206550,"Rt17, ",Rt17A,U-channel (with other signage),4 x 8 Ad,-,Large Can (on Ground) ,No
1312,OXFOHYD2,Oxford at Hyde Park WB - #1312,42.9752750,-81.3223690,"Rt17, ",Rt17A,U-channel (stop specific),4 x 8 Ad,Black Ad Bench ,-,Yes
1313,OXFOIND1,Oxford east of Industrial EB - #1313,43.0211610,-81.1641670,"Rt36, ",-,Wood Hydro / Light Pole,-,-,-,No
1314,OXFOIND2,Oxford at Industrial WB - #1314,43.0204980,-81.1669150,"Rt36, ",-,Wood Hydro / Light Pole,-,-,-,No
1315,OXFOIND3,Oxford west of Industrial EB - #1315,43.0204010,-81.1668800,"Rt36, ",-,U-channel (with other signage),-,-,-,No
1316,OXFOJUNI,Oxford at Juniper EB - #1316,42.9795710,-81.3068500,"Rt17, ",-,Wood Hydro / Light Pole,-,-,-,No
1317,OXFOLAR1,Oxford at Laruel EB - #1317,42.9813100,-81.3009120,"Rt17, ",-,Wood Hydro / Light Pole,-,Black Ad Bench ,-,No
1318,OXFOLAR2,Oxford at Laurel WB - #1318,42.9815670,-81.3005900,"Rt17, ",-,Wood Hydro / Light Pole,-,Black Ad Bench ,-,No
1319,OXFOLYMA,Oxford at Lyman WB - #1319,43.0052990,-81.2197490,"Rt4, Rt17, Rt104, ",-,Wood Hydro / Light Pole,-,-,-,No
1320,OXFOMAI1,Oxford at Maitland EB - #1320,42.9986420,-81.2424010,"Rt4, Rt17, Rt104, ",-,U-channel (stop specific),-,-,Small Can (mounted),No
1321,OXFOMAI2,Oxford at Maitland WB - #1321,42.9985520,-81.2430880,"Rt4, Rt17, Rt104, ",-,U-channel (stop specific),-,-,-,No
1322,OXFOMORN,Oxford at Mornington EB - #1322,43.0073800,-81.2120570,"Rt4, Rt17, Rt20, Rt104, ",-,TBD Following Construction,-,Black Ad Bench ,-,No
1323,OXFOOAKS,Oxford at Oakside WB - #1323,43.0070130,-81.2139010,"Rt4, Rt17, Rt104, ",-,Wood Hydro / Light Pole,4 x 8 Ad,-,Large Can (on Ground) ,No
1324,OXFOOLH1,Oxford at Old Hunt EB - #1324,42.9726050,-81.3310860,"Rt17, ",Rt17A,U-channel (stop specific),-,Black Ad Bench ,-,No
1325,OXFOOLH2,Oxford at Old Hunt WB - #1325,42.9726820,-81.3311090,"Rt17, ",Rt17A,U-channel (stop specific),-,Black Ad Bench ,-,No
1326,OXFOPLAT,Oxford at Platts Lane WB - #1326,42.9899330,-81.2724890,"Rt17, Rt91, ",-,U-channel (stop specific),-,-,-,Yes
1327,OXFOPRO1,Oxford at Proudfoot Lane EB - #1327,42.9852620,-81.2874290,"Rt17, Rt91, ",-,U-channel (with other signage),4 x 8 Ad,-,Small Can (mounted),Yes
1328,OXFOPRO2,Oxford at Proudfoot WB - #1328,42.9854910,-81.2873810,"Rt17, Rt91, ",-,U-channel (stop specific),-,Black Ad Bench ,-,No
1329,OXFOQUE1,Oxford at Quebec EB - #1329,43.0037860,-81.2247180,"Rt4, Rt17, Rt104, ",-,Wood Hydro / Light Pole,-,-,-,No
1330,OXFOQUE2,Oxford at Quebec WB - #1330,43.0039360,-81.2244600,"Rt4, Rt17, Rt104, ",-,U-channel (stop specific),-,-,-,No
1331,OXFORAT1,Oxford at Rathowen EB - #1331,42.9909250,-81.2684070,"Rt17, ",-,U-channel (stop specific),-,-,-,No
1332,OXFORAT2,Oxford at Rathowen WB - #1332,42.9910050,-81.2683650,"Rt17, ",-,U-channel (stop specific),-,-,-,No
1333,OXFORIC1,Oxford at Richmond EB - #1333,42.9955860,-81.2527630,"Rt4, Rt17, Rt91, Rt104, ",-,U-channel (stop specific),4 x 8 Ad,-,Large Can (on Ground) ,Yes
1334,OXFORIC2,Oxford at Richmond WB - #1334,42.9954330,-81.2537620,"Rt17, Rt91, ",-,U-channel (stop specific),4 x 12 Ad,-,Large Can (on Ground) ,Yes
1336,OXFOROE2,Oxford at Roehampton WB - #1336,43.0100510,-81.2035140,"Rt4, Rt17, Rt20, Rt104, ",-,Metal Hydro / Light Pole,-,-,-,No
1337,OXFOROY1,Oxford at Royal York EB - #1337,42.9747460,-81.3237090,"Rt17, ",Rt17A,U-channel (stop specific),-,Black Ad Bench ,-,No
1338,OXFOROY2,Oxford at Royal York WB - #1338,42.9746460,-81.3243640,"Rt17, ",Rt17A,U-channel (stop specific),-,-,-,No
1339,OXFOROY3,St Aidens Church - #1339,42.9738130,-81.3269090,"Rt17, ",Rt17A,U-channel (stop specific),-,Black Ad Bench ,-,No
1340,OXFOROY4,Marie Curie School - #1340,42.9738020,-81.3273130,"Rt17, ",Rt17A,Wood Hydro / Light Pole,4 x 8 Non-Ad,Black Ad Bench ,Small Can (mounted),No
1341,OXFOSAN1,Oxford at Sanatorium EB - #1341,42.9719550,-81.3333390,"Rt17, ",Rt17A,U-channel (stop specific),-,Black Ad Bench ,-,No
1343,OXFOSEC1,Oxford at Second EB - #1343,43.0121410,-81.1958600,"Rt17, Rt36, ",-,U-channel (with other signage),4 x 8 Ad,-,Large Can (on Ground) ,No
1344,OXFOSEC2,Oxford at Fanshawe College Blvd WB - #1344,43.0125110,-81.1950510,"Rt17, Rt36, ",-,Wood Hydro / Light Pole,4 x 8 Non-Ad,-,-,No
1345,OXFOSPIT,Oxford at Spittal EB - #1345,43.0053370,-81.2193360,"Rt4, Rt17, Rt104, ",-,Wood Hydro / Light Pole,-,-,-,No
1346,OXFOSTE1,Oxford at Sterling EB - #1346,43.0033470,-81.2261990,"Rt4, Rt17, Rt104, ",-,U-channel (stop specific),-,-,-,No
1347,OXFOSTE2,Oxford at Sterling WB - #1347,43.0033490,-81.2264710,"Rt4, Rt17, Rt104, ",-,U-channel (with other signage),-,-,Large Can (on Ground) ,No
1348,OXFOSTRA,Oxford at Strand EB - #1348,43.0044940,-81.2222680,"Rt4, Rt17, Rt104, ",-,Wood Hydro / Light Pole,-,-,-,No
1349,OXFOSTUA,Oxford at Stuart WB - #1349,43.0047070,-81.2217640,"Rt4, Rt17, Rt104, ",-,U-channel (stop specific),-,-,Small Can (mounted),No
1350,OXFOTAL1,Oxford at Talbot EB - #1350,42.9939410,-81.2581690,"Rt17, ",-,Concrete Hydro / Light Pole,-,Black Ad Bench ,-,No
1351,OXFOTAL2,Oxford at Talbot WB - #1351,42.9942240,-81.2578460,"Rt17, ",-,U-channel (stop specific),-,-,-,Yes
1352,OXFOTHI1,Oxford at Third EB - #1352,43.0134290,-81.1914530,"Rt17, Rt36, ",-,U-channel (stop specific),-,-,-,No
1353,OXFOTHI2,Oxford at Third WB - #1353,43.0138020,-81.1905230,"Rt36, ",-,Wood Hydro / Light Pole,4 x 8 Non-Ad,-,-,No
1354,OXFOWAT1,Oxford at Waterloo EB - #1354,42.9968460,-81.2483950,"Rt4, Rt17, Rt104, ",-,U-channel (stop specific),-,-,-,No
1355,OXFOWAT2,Oxford at Waterloo WB - #1355,42.9971420,-81.2478650,"Rt4, Rt17, Rt104, ",-,U-channel (stop specific),4 x 8 Non-Ad,Other Bench,-,No
1356,OXFOWEL1,Oxford at Wellington EB - #1356,42.9960410,-81.2511860,"Rt4, Rt17, Rt104, ",-,Metal Hydro / Light Pole,-,Black Ad Bench ,-,No
1357,OXFOWEL2,Oxford at Wellington WB - #1357,42.9962450,-81.2508720,"Rt4, Rt17, Rt104, ",-,Wood Hydro / Light Pole,-,-,-,No
1358,OXFOWHA1,Oxford at Wharncliffe EB - #1358,42.9920730,-81.2644640,"Rt17, Rt91, ",-,U-channel (with other signage),-,Black Ad Bench ,Large Can (on Ground) ,No
1359,OXFOWHA2,Oxford at Wharncliffe WB - #1359,42.9921330,-81.2646370,"Rt17, ",-,Concrete Hydro / Light Pole,-,-,-,No
1360,OXFOWIL1,Oxford at William EB - #1360,42.9993000,-81.2401560,"Rt4, Rt17, Rt104, ",-,U-channel (stop specific),-,-,-,No
1361,OXFOWIL2,Oxford at William WB - #1361,42.9993810,-81.2403210,"Rt4, Rt17, Rt104, ",-,U-channel (stop specific),4 x 8 Ad,-,Large Can (on Ground) ,No
1362,OXFOWIST,Oxford at Wistow WB - #1362,43.0076118,-81.2118550,"Rt4, Rt17, Rt104, ",-,U-channel (with other signage),-,-,Small Can (mounted),No
1363,OXFOWON1,Oxford at Wonderland EB - #1363,42.9841730,-81.2912800,"Rt17, Rt91, ",-,U-channel (stop specific),4 x 8 Ad,-,Large Can (on Ground) ,No
1364,OXFOWON2,Oxford at Wonderland WB - #1364,42.9840310,-81.2923170,"Rt17, Rt33, Rt91, ",-,Wood Hydro / Light Pole,4 x 8 Ad,-,Large Can (on Ground) ,No
1371,PAGEVMPW,Page at Vetrans WB - #1371,43.0160190,-81.1589600,"Rt36, ",-,U-channel (with other signage),4 x 8 Non-Ad,-,-,No
1373,PARKMAEN,Parkwood Hospital Main Entrance WB - #1373,42.9560146,-81.2252318,"Rt6, ",-,Metal Hydro / Light Pole,-,-,-,Yes
1376,PARKWEC2,Parkwood Hospital at  Western Counties Rd WB - #1376,42.9568500,-81.2237200,"Rt6, ",-,U-channel (stop specific),-,-,-,No
1378,PERTWIN1,Perth Dr at Windermere NB - #1378,43.0149200,-81.2749390,"Rt10, Rt13, Rt34, ",-,Metal Hydro / Light Pole,-,-,-,No
1379,PERTWIN2,Perth at Windermere SB - #1379,43.0149750,-81.2750940,"Rt6, Rt10, Rt13, Rt34, ",-,U-channel (stop specific),-,-,-,No
1383,PHILPHIL,Phillbrook at Phillbrook - #1383,43.0372810,-81.2631010,"Rt34, ",-,Metal Hydro / Light Pole,-,-,-,No
1385,PHILSILV,Phillbrook at Silverbrook WB - #1385,43.0384740,-81.2587450,"Rt34, ",-,Metal Hydro / Light Pole,-,-,-,No
1389,PLATCHE1,Platts Lane at Cherryhill Place NB - #1389,42.9922200,-81.2729900,"Rt9, ",-,U-channel (stop specific),4 x 8 Non-Ad,-,-,No
1390,PLATCHE2,Platts Lane at Cherryhill Place SB - #1390,42.9919660,-81.2730380,"Rt9, ",-,U-channel (stop specific),4 x 8 Non-Ad,-,Small Can (mounted),No
1391,PLATOXF1,Platts Lane at Oxford NB - #1391,42.9904990,-81.2720740,"Rt9, Rt20, ",-,U-channel (stop specific),4 x 8 Non-Ad,-,Small Can (mounted),No
1392,PLATOXF2,Platts Lane at Oxford SB - #1392,42.9903160,-81.2720410,"Rt9, Rt20, ",-,U-channel (stop specific),4 x 8 Non-Ad,-,-,No
1393,PLATTRO1,Platts Lane at Trott NB - #1393,42.9955350,-81.2746960,"Rt9, Rt33, ",-,U-channel (with other signage),4 x 8 Non-Ad,Black Ad Bench ,-,No
1394,PLATTRO2,Platts Lane at Trott SB - #1394,42.9950090,-81.2745940,"Rt9, Rt33, ",-,Wood Hydro / Light Pole,-,-,-,No
1399,PONDAILS,Pond Mills at Ailsa SB - #1399,42.9703780,-81.2044890,"Rt1, ",Rt1A,U-channel (stop specific),-,-,-,No
1400,PONDBAN1,Pond Mills at Banbury NB - #1400,42.9567850,-81.1994110,"Rt10, ",-,Wood Hydro / Light Pole,4 x 8 Non-Ad,-,-,No
1401,PONDBAN2,Pond Mills at Banbury SB - #1401,42.9574860,-81.1997190,"Rt10, Rt16, ",-,Wood Hydro / Light Pole,-,-,-,No
1402,PONDBRA2,Pond Mills south of Bradley SB - #1402,42.9400330,-81.1922380,"Rt30, ",-,Wood Hydro / Light Pole,4 x 8 Non-Ad,-,-,Yes
1405,PONDBUC4,Pond Mills at Buchanan SB - #1405,42.9359580,-81.1914110,"Rt30, ",-,Wood Hydro / Light Pole,-,-,-,No
1406,PONDBURL,Pond Mills at Burlinton Gate NB - #1406,42.9637570,-81.2010370,"Rt1, ",Rt1A,Wood Hydro / Light Pole,-,-,-,No
1407,PONDCLE1,Pond Mills at Cleveland NB - #1407,42.9674600,-81.2020570,"Rt1, ",Rt1A,Wood Hydro / Light Pole,4 x 8 Non-Ad,-,Large Can (on Ground) ,No
1408,PONDCLE2,Pond Mills at Cleveland SB - #1408,42.9675990,-81.2022360,"Rt1, ",Rt1A,Wood Hydro / Light Pole,-,-,Large Can (on Ground) ,No
1409,PONDCOMM,Pond Mills at Commissioners NB - #1409,42.9621330,-81.2006630,"Rt1, ",Rt1A,Wood Hydro / Light Pole,-,-,Large Can (on Ground) ,No
1410,PONDDEV2,Pond Mills north of Deveron SB - #1410,42.9604940,-81.2004090,"Rt10, Rt16, ",-,Wood Hydro / Light Pole,4 x 8 Non-Ad,-,Large Can (on Ground) ,No
1411,PONDDEV4,Pond Mills south of Deveron SB - #1411,42.9551380,-81.1989650,"Rt10, ",-,U-channel (stop specific),4 x 8 Non-Ad,-,-,No
1412,PONDEGER,Pond Mills at Thompson NB - #1412,42.9727400,-81.2098050,"Rt1, ",Rt1A,Concrete Hydro / Light Pole,-,-,-,No
1413,PONDENT2,Pond Mills at Enterprise SB - #1413,42.9320110,-81.1915690,"Rt30, ",-,Wood Hydro / Light Pole,-,-,-,No
1414,PONDMILL,Pond Mills at Millers SB - #1414,42.9493110,-81.1955250,"Rt10, ",-,U-channel (stop specific),-,-,-,Yes
1415,PONDMIR1,450 Pond Mills - #1415,42.9530630,-81.1964760,"Rt10, ",-,Wood Hydro / Light Pole,-,-,-,No
1416,PONDMIR2,Pond Mills at Millridge SB - #1416,42.9505170,-81.1962720,"Rt10, ",-,Wood Hydro / Light Pole,-,-,-,No
1417,PONDMIR3,Pond Mills at Millridge NB - #1417,42.9513710,-81.1964030,"Rt10, ",-,U-channel (with other signage),-,-,-,No
1418,PONDMIR4,492 Pond Mills - #1418,42.9530530,-81.1966030,"Rt10, ",-,Wood Hydro / Light Pole,-,-,-,No
1419,PONDOLDH,Pond Mills South of Commissioners NB - #1419,42.9606780,-81.2002780,"Rt10, ",-,Wood Hydro / Light Pole,4 x 8 Ad,-,-,No
1420,PONDPONV,Pond Mills at Pondview NB - #1420,42.9493010,-81.1953210,"Rt10, ",-,U-channel (with other signage),-,-,-,Yes
1421,PONDSCE1,Pond Mills at Scenic NB - #1421,42.9718970,-81.2074630,"Rt1, ",Rt1A,U-channel (stop specific),4 x 8 Non-Ad,-,-,No
1422,PONDSCE4,Pond Mills south of Scenic SB - #1422,42.9717410,-81.2072160,"Rt1, ",Rt1A,U-channel (with other signage),-,Wooden with concrete base ,-,No
1423,PROUBEA1,Proudfoot at Beaverbrook EB - #1423,42.9840890,-81.2814580,"Rt20, Rt33, ",-,U-channel (stop specific),4 x 8 Non-Ad,-,-,No
1424,PROUBEA2,Proudfoot at Beaverbrook WB - #1424,42.9841850,-81.2814900,"Rt20, Rt33, ",-,U-channel (stop specific),4 x 8 Non-Ad,-,-,No
1425,PROUBEA3,Proudfoot at Beaverbrook SB - #1425,42.9894860,-81.2901550,"Rt20, ",-,Wood Hydro / Light Pole,4 x 8 Non-Ad,-,-,No
1427,PROUFAR1,Proudfoot north of Farrah NB - #1427,42.9888370,-81.2897290,"Rt20, ",-,U-channel (with other signage),4 x 8 Non-Ad,-,-,No
1428,PROUFAR2,Proudfoot at Farrah SB - #1428,42.9862700,-81.2885460,"Rt20, Rt33, ",-,Wood Hydro / Light Pole,-,-,-,No
1429,PROUFAR3,Proudfoot at Farrah NB - #1429,42.9871360,-81.2888820,"Rt20, ",-,Wood Hydro / Light Pole,-,-,-,No
1430,PROUOXF1,Proudfoot north of Oxford NB - #1430,42.9861000,-81.2883660,"Rt20, ",-,Wood Hydro / Light Pole,-,-,-,No
1431,PROUOXF2,Proudfoot at Oxford SB - #1431,42.9848050,-81.2878370,"Rt20, Rt33, ",-,Metal Hydro / Light Pole,-,-,-,No
1432,PROUOXF3,Proudfoot south of Oxford NB - #1432,42.9846690,-81.2876400,"Rt20, Rt33, ",-,Metal Hydro / Light Pole,-,-,-,No
1434,QUEBDUFF,Quebec at Dufferin SB - #1434,42.9944800,-81.2199810,"Rt20, ",-,Wood Hydro / Light Pole,-,-,-,No
1435,QUEBDUND,Quebec at Dundas NB - #1435,42.9928910,-81.2190930,"Rt20, ",-,Wood Hydro / Light Pole,-,-,-,No
1436,QUEBELI1,Quebec at Elias NB - #1436,42.9971770,-81.2211880,"Rt20, ",-,Wood Hydro / Light Pole,-,-,-,No
1437,QUEBELI2,Quebec at Elias SB - #1437,42.9969060,-81.2212120,"Rt20, ",-,Concrete Hydro / Light Pole,-,-,-,No
1438,QUEBLOR1,Quebec at Lorne NB - #1438,42.9959280,-81.2205810,"Rt20, ",-,U-channel (stop specific),-,-,-,No
1439,QUEBLOR2,Quebec at Lorne SB - #1439,42.9953270,-81.2203970,"Rt20, ",-,U-channel (with other signage),-,-,-,No
1440,QUEBMORN,Quebec at Mornington SB - #1440,43.0003720,-81.2229390,"Rt20, ",-,U-channel (stop specific),-,-,-,No
1441,QUEBQUEE,Quebec at Queens NB - #1441,42.9939210,-81.2196160,"Rt20, ",-,U-channel (stop specific),-,-,-,No
1442,QUEECLAR,Queens at Clarence WB - #1442,42.9858600,-81.2475060,"Rt2, Rt3, Rt5, Rt7, Rt9, Rt12, Rt13, Rt19, Rt20, Rt94, Rt106, ",-,Metal Hydro / Light Pole,-,-,Large Can (on Ground) ,No
1443,QUENRIDO,Queens at Ridout WB - #1443,42.9836800,-81.2542070,"Rt2, Rt5, Rt7, Rt9, Rt12, Rt19, Rt20, Rt94, Rt102, ",-,Metal Hydro / Light Pole,-,-,-,No
1445,RAILKENN,Railton at Kennedy Place SB - #1445,42.9944440,-81.1520930,"Rt35, ",-,U-channel (stop specific),-,-,Small Can (mounted),No
1446,RAILPORT,Railton at Portsmouth SB - #1446,42.9882410,-81.1502320,"Rt35, ",-,Metal Hydro / Light Pole,-,-,-,No
1447,RAILSADD,Railton at Saddy SB - #1447,42.9908180,-81.1512720,"Rt35, ",-,Metal Hydro / Light Pole,-,-,Small Can (mounted),No
1454,REARROTH,Reardon at Rothwell WB - #1454,42.9620150,-81.1768930,"Rt24, ",-,Metal Hydro / Light Pole,-,-,-,No
1455,REGEMAIT,Regent at Maitland WB - #1455,43.0087970,-81.2476920,"Rt27, ",-,U-channel (stop specific),-,-,-,No
1456,REGEWILL,Regent at William EB - #1456,43.0094250,-81.2453840,"Rt27, ",-,U-channel (stop specific),-,-,-,No
1460,RICHCANT,Richmond at Canterbury NB - #1460,43.0192820,-81.2770790,"Rt10, Rt13, ",-,U-channel (stop specific),-,Black Ad Bench ,-,No
1463,RICHCENT,Richmond at Central SB - #1463,42.9901760,-81.2508730,"Rt4, Rt6, Rt13, Rt15, Rt102, Rt104, ",-,U-channel (stop specific),-,-,Large Can (on Ground) ,No
1464,RICHCHE1,Richmond at Cheapside NB - #1464,43.0015270,-81.2562050,"Rt6, Rt13, Rt15, Rt106, ",-,U-channel (with other signage),4 x 8 Ad,-,-,No
1465,RICHCHE2,Richmond at Cheapside SB - #1465,43.0017850,-81.2565100,"Rt6, Rt13, Rt102, ",-,Wood Hydro / Light Pole,-,-,-,No
1467,RICHDUF2,Richmond at Dufferin SB - #1467,42.9869600,-81.2507810,"Rt4, Rt6, Rt13, Rt15, Rt102, Rt104, ",-,U-channel (stop specific),-,-,Large Can (on Ground) ,No
1475,RICHGREY,Richmond at Grey SB - #1475,42.9767810,-81.2462570,"Rt6, ",-,U-channel (stop specific),-,-,-,No
1476,RICHGRO1,Richmond at Grosvenor NB - #1476,43.0000390,-81.2553830,"Rt6, Rt13, Rt15, Rt90, Rt106, ",-,U-channel (stop specific),4 x 8 Non-Ad,-,-,Yes
1477,RICHGRO2,Richmond at Grosvenor SB - #1477,42.9993250,-81.2552460,"Rt6, Rt13, Rt15, Rt90, Rt102, ",-,U-channel (stop specific),4 x 8 Ad,-,-,Yes
1478,RICHHOT1,Richmond north of Horton NB - #1478,42.9793780,-81.2474390,"Rt4, Rt15, Rt104, ",-,U-channel (stop specific),-,-,-,No
1479,RICHHOT2,Richmond at Horton SB - #1479,42.9792960,-81.2475190,"Rt6, ",-,U-channel (stop specific),-,-,-,No
1480,RICHHOT3,Richmond south Horton NB - #1480,42.9787070,-81.2470830,"Rt6, ",-,U-channel (stop specific),-,-,-,No
1481,RICHHUR1,Richmond at Huron NB - #1481,43.0073420,-81.2594060,"Rt6, Rt13, Rt106, ",-,Wood Hydro / Light Pole,-,-,-,No
1482,RICHHUR2,Richmond at Huron SB - #1482,43.0071670,-81.2594240,"Rt6, Rt13, Rt102, ",-,Wood Hydro / Light Pole,-,-,-,No
1483,RICHHYM1,Richmond at Hyman NB - #1483,42.9912220,-81.2508860,"Rt4, Rt6, Rt13, Rt15, Rt104, Rt106, ",-,U-channel (with other signage),-,-,Large Can (on Ground) ,Yes
1485,RICHJACK,Richmond at Jacksway SB - #1485,43.0232010,-81.2809300,"Rt10, Rt13, ",-,U-channel (stop specific),-,-,-,No
1486,RICHJAM1,Richmond at St. James NB - #1486,42.9974990,-81.2541370,"Rt6, Rt13, Rt15, Rt106, ",-,U-channel (with other signage),-,Black Ad Bench ,Large Can (on Ground) ,No
1487,RICHJAM2,Richmond at St. James SB - #1487,42.9977240,-81.2543610,"Rt6, Rt13, Rt15, Rt102, ",-,Wood Hydro / Light Pole,-,-,-,No
1488,RICHKEN1,Richmond at Angel NB - #1488,42.9883740,-81.2506780,"Rt4, Rt6, Rt13, Rt15, Rt104, Rt106, ",-,U-channel (stop specific),-,Black Non Ad  ,Large Can (on Ground) ,No
1489,RICHKEN2,Richmond at Kent SB - #1489,42.9881560,-81.2507520,"Rt4, Rt6, Rt13, Rt15, Rt102, Rt104, ",-,U-channel (stop specific),-,Wooden with concrete base ,Large Can (on Ground) ,No
1490,RICHKIN1,Richmond at King NB - #1490,42.9823400,-81.2489000,"Rt4, Rt6, Rt15, Rt104, ",-,U-channel (with other signage),-,-,Large Can (on Ground) ,No
1493,RICHMILL,Richmond at Mill SB - #1493,42.9929410,-81.2519480,"Rt4, Rt6, Rt13, Rt15, Rt102, Rt104, ",-,U-channel (stop specific),-,-,Large Can (on Ground) ,No
1494,RICHOXF1,Richmond at Oxford NB - #1494,42.9959770,-81.2533010,"Rt6, Rt13, Rt15, Rt90, Rt106, ",-,U-channel (stop specific),4 x 8 Ad,Black Non Ad  ,Large Can (on Ground) ,Yes
1495,RICHOXF2,Richmond at Oxford SB - #1495,42.9949090,-81.2529150,"Rt4, Rt6, Rt13, Rt15, Rt90, Rt102, Rt104, ",-,U-channel (stop specific),-,-,-,No
1496,RICHPALL,Richmond at Pall Mall NB - #1496,42.9927730,-81.2516490,"Rt4, Rt6, Rt13, Rt15, Rt104, Rt106, ",-,U-channel (stop specific),-,Black Non Ad  ,Large Can (on Ground) ,Yes
1497,RICHPAR2,Richmond at Parkdale Ave SB - #1497,43.0111950,-81.2636290,"Rt102, ",-,Wood Hydro / Light Pole,-,-,-,No
1501,RICHQUEE,Richmond at Queens NB - #1501,42.9852690,-81.2503400,"Rt4, Rt6, Rt13, Rt15, Rt90, Rt104, Rt106, ",-,U-channel (stop specific),4 x 8 Non-Ad,Black Ad Bench ,-,No
1502,RICHRAY1,Richmond north of Raymond NB - #1502,43.0131880,-81.2655880,"Rt6, ",-,U-channel (stop specific),-,Black Ad Bench ,-,No
1503,RICHRAY2,Richmond north of Raymond SB - #1503,43.0129990,-81.2655400,"Rt102, ",-,U-channel (stop specific),-,-,-,No
1506,RICHREG1,Richmond at Regent NB - #1506,43.0056930,-81.2583600,"Rt6, Rt13, Rt106, ",-,U-channel (with other signage),-,-,-,No
1508,RICHSHAV,Richmond at Shavian SB - #1508,43.0214090,-81.2799950,"Rt10, Rt13, ",-,Metal Hydro / Light Pole,4 x 8 Ad,-,-,No
1509,RICHSIM1,Richmond at Simcoe NB - #1509,42.9773080,-81.2464130,"Rt6, Rt104, ",-,Wood Hydro / Light Pole,-,-,-,No
1511,RICHSUNN,Richmond at Sunnyside NB - #1511,43.0217200,-81.2799420,"Rt10, Rt13, ",-,Concrete Hydro / Light Pole,-,Black Ad Bench ,-,No
1512,RICHUNI1,Richmond at University NB - #1512,43.0088650,-81.2610280,"Rt6, Rt90, ",-,Wood Hydro / Light Pole,-,-,-,No
1513,RICHUNI2,Richmond at University SB - #1513,43.0092320,-81.2616260,"Rt90, Rt102, ",-,Wood Hydro / Light Pole,4 x 8 Non-Ad,Black Ad Bench ,-,No
1514,RICHVIC1,Richmond at Victoria NB - #1514,43.0036090,-81.2572790,"Rt6, Rt13, Rt106, ",-,Metal Hydro / Light Pole,-,-,Small Can (mounted),No
1515,RICHVIC2,Richmond at Victoria SB - #1515,43.0038460,-81.2575570,"Rt6, Rt13, Rt102, ",-,Wood Hydro / Light Pole,-,-,-,No
1516,RICHWEC1,Richmond at Westchester NB - #1516,43.0180730,-81.2749890,"Rt10, Rt13, ",-,Wood Hydro / Light Pole,-,Black Ad Bench ,Small Can (mounted),No
1518,RICHWES2,Richmond at Western SB - #1518,43.0196850,-81.2781430,"Rt10, Rt13, ",-,Metal Hydro / Light Pole,4 x 8 Ad,-,Small Can (mounted),No
1519,RICHWES4,1548 Richmond - #1519,43.0189840,-81.2769380,"Rt10, Rt13, ",-,Concrete Hydro / Light Pole,4 x 8 Non-Ad,Black Ad Bench ,-,No
1520,RICHWIN1,Richmond north of Windermere NB - #1520,43.0168080,-81.2727410,"Rt10, Rt13, Rt90, ",-,U-channel (stop specific),4 x 8 Non-Ad,Black Ad Bench ,-,No
1521,RICHWIN2,Richmond at Windermere SB - #1521,43.0152040,-81.2702790,"Rt90, ",-,Metal Hydro / Light Pole,4 x 8 Non-Ad,Black Ad Bench ,Large Can (on Ground) ,No
1523,RICHWYND,Richmond at Wyndham Gate SB - #1523,43.0179660,-81.2751390,"Rt10, Rt13, ",-,Concrete Hydro / Light Pole,-,-,Small Can (mounted),No
1531,RIDOBAKE,Ridout at Baker NB - #1531,42.9674070,-81.2462570,"Rt4, ",-,Wood Hydro / Light Pole,-,-,-,No
1532,RIDOBAS1,Ridout at Baseline NB - #1532,42.9605170,-81.2427180,"Rt4, ",-,U-channel (stop specific),-,-,-,No
1533,RIDOBAS2,Ridout at Baseline SB - #1533,42.9612460,-81.2431710,"Rt4, ",-,Wood Hydro / Light Pole,-,-,-,No
1537,RIDOCRA1,Ridout at Craig NB - #1537,42.9742640,-81.2496960,"Rt4, Rt15, ",-,Wood Hydro / Light Pole,-,-,-,No
1538,RIDOCRA2,Ridout at Craig SB - #1538,42.9743350,-81.2498320,"Rt4, Rt15, Rt104, ",-,Wood Hydro / Light Pole,-,-,-,No
1539,RIDOELMW,Ridout at Elmwood SB - #1539,42.9726010,-81.2489390,"Rt4, Rt15, Rt104, ",-,Wood Hydro / Light Pole,4 x 8 Non-Ad,-,-,No
1540,RIDOEME1,Ridout at Emery NB - #1540,42.9647150,-81.2448730,"Rt4, ",-,U-channel (stop specific),-,-,-,No
1541,RIDOEME2,Ridout at Emery SB - #1541,42.9652270,-81.2451790,"Rt4, ",-,U-channel (stop specific),-,-,-,No
1544,RIDOGRAN,Ridout & Grand Ave NB - #1544,42.9714310,-81.2482450,"Rt4, ",-,U-channel (stop specific),-,-,-,No
1545,RIDOHICK,Ridout at Hickson NB - #1545,42.9622050,-81.2435740,"Rt4, ",-,U-channel (with other signage),-,-,-,No
1546,RIDOHORT,Ridout at Horton SB - #1546,42.9773590,-81.2514680,"Rt4, Rt15, Rt104, ",-,U-channel (stop specific),-,Black Ad Bench ,-,Yes
1547,RIDOING1,Ridout at Ingleside NB - #1547,42.9758510,-81.2505660,"Rt4, Rt15, ",-,U-channel (stop specific),-,-,-,No
1553,RIDOMOU2,Ridout at Mountsfiled SB - #1553,42.9595040,-81.2422850,"Rt4, ",-,U-channel (with other signage),-,-,-,No
1554,RIDOROSE,Ridout at Rosel SB - #1554,42.9629090,-81.2440230,"Rt4, ",-,U-channel (stop specific),-,-,-,No
1555,RIDOTEC1,Ridout at Tecumseh NB - #1555,42.9694270,-81.2472210,"Rt4, ",-,Wood Hydro / Light Pole,-,-,-,No
1556,RIDOTEC2,Ridout at Tecumseh SB - #1556,42.9695890,-81.2474320,"Rt4, ",-,U-channel (stop specific),-,-,-,No
1557,RIDOWINS,Ridout at Windsor SB - #1557,42.9671040,-81.2461590,"Rt4, ",-,U-channel (stop specific),-,-,-,No
