640,EDWATECU,Edward at Tecumseh SB - #640,42.9680400,-81.2575750,"Rt15, ",-,U-channel (stop specific),-,-,-,No
641,ELMWCATH,Elmwood at Cathcart WB - #641,42.9707790,-81.2543550,"Rt15, ",-,U-channel (with other signage),-,-,-,No
642,ELMWMARL,Elmwood at Marley Place WB - #642,42.9712010,-81.2505630,"Rt15, ",-,U-channel (with other signage),-,-,-,No
643,ELMWWORT,Elmwood at Wortley WB - #643,42.9709340,-81.2527230,"Rt15, ",-,Wood Hydro / Light Pole,4 x 8 Non-Ad,-,-,No
644,EMERHIW1,Emery at Highwood EB - #644,42.9635840,-81.2703170,"Rt7, ",-,U-channel (stop specific),-,-,-,No
645,EMERHIW2,Emery at Highwood WB - #645,42.9636810,-81.2700680,"Rt7, ",-,U-channel (with other signage),-,-,-,No
646,EMERPADD,Emery at Paddington EB - #646,42.9635610,-81.2635740,"Rt7, ",-,Wood Hydro / Light Pole,-,-,-,No
647,EMERPHY1,Emery at Phyllis EB - #647,42.9634730,-81.2735140,"Rt7, ",-,Wood Hydro / Light Pole,4 x 8 Non-Ad,-,-,No
648,EMERPHY2,Emery at Phyllis WB - #648,42.9635710,-81.2728460,"Rt7, ",-,U-channel (with other signage),-,-,-,No
649,EMERWIN1,Emery west of Winston EB - #649,42.9637190,-81.2669210,"Rt7, ",-,U-channel (stop specific),-,-,-,No
650,EMERWIN2,Emery at Winston WB - #650,42.9637680,-81.2676500,"Rt7, ",-,U-channel (with other signage),-,-,-,No
651,ENTEHUBR,Enterprise at Hubrey EB - #651,42.9330340,-81.1846890,"Rt30, ",-,U-channel (with other signage),-,-,-,No
652,ENTEMID1,Enterprise at Midpark EB - #652,42.9324970,-81.1869070,"Rt30, ",-,Wood Hydro / Light Pole,-,-,-,No
653,ENTEPOM1,Enterprise at Pond Mills EB - #653,42.9315610,-81.1897310,"Rt30, ",-,Wood Hydro / Light Pole,-,-,-,No
654,ERNEBRA1,Ernest at Bradley NB - #654,42.9348160,-81.2363990,"Rt4, ",Rt4B,Metal Hydro / Light Pole,4 x 8 Non-Ad,-,Large Can (on Ground) ,No
655,ERNEBRA2,Ernest at Bradley SB - #655,42.9346120,-81.2365040,"Rt4, ",Rt4A,U-channel (with other signage),-,-,-,No
656,ERNECON1,Ernest at Conway NB - #656,42.9327090,-81.2364300,"Rt4, ",Rt4B,U-channel (with other signage),4 x 8 Non-Ad,-,Large Can (on Ground) ,No
657,ERNECON2,Ernest at Conway SB - #657,42.9330530,-81.2365510,"Rt4, ",Rt4A,U-channel (stop specific),-,-,-,No
658,ERNEELVI,Ernest at Elvira SB - #658,42.9393410,-81.2385390,"Rt4, ",Rt4A,U-channel (with other signage),-,-,-,No
659,ERNEFEN1,Ernest at Fennel NB - #659,42.9294880,-81.2359400,"Rt4, ",Rt4B,Metal Hydro / Light Pole,-,-,-,No
660,ERNEFEN2,Ernest at Fennel SB - #660,42.9302850,-81.2357750,"Rt4, ",Rt4A,U-channel (stop specific),-,-,-,No
661,ERNEFINC,Ernest at Finch SB - #661,42.9285600,-81.2363070,"Rt4, ",Rt4A,U-channel (stop specific),-,-,-,No
662,ERNEJAL1,Ernest at Jalna NB - #662,42.9411070,-81.2367990,"Rt4, ",-,U-channel (stop specific),-,-,-,No
663,ERNEJAL2,Ernest at Jalna SB - #663,42.9407000,-81.2374010,"Rt4, ",Rt4A,U-channel (stop specific),-,-,-,No
665,ERNEMUR1,Opposite Sir Aurther Carty PS - #665,42.9380130,-81.2384570,"Rt4, ",Rt4B,U-channel (stop specific),-,-,-,No
666,ERNEMUR3,Ernest at Muriel NB - #666,42.9364250,-81.2375080,"Rt4, ",Rt4B,Metal Hydro / Light Pole,-,-,-,No
667,ERNEPAUL,Ernest at Pauline SB - #667,42.9370180,-81.2382410,"Rt4, ",Rt4A,U-channel (with other signage),-,-,-,No
668,ERNESCO1,Ernest at Scotchmere SB - #668,42.9269150,-81.2359570,"Rt4, ",Rt4A,U-channel (stop specific),-,-,-,No
669,ERNESCO2,Ernest at Scotchmere NB - #669,42.9266540,-81.2358000,"Rt4, ",Rt4B,Metal Hydro / Light Pole,-,-,-,No
670,EXETMEG,Exeter at Meg EB - #670,42.9247900,-81.2284890,"Rt4, ",Rt4A,Concrete Hydro / Light Pole,-,-,-,No
671,EXETSHOL,Exeter at Sholto WB - #671,42.9249660,-81.2282590,"Rt4, ",Rt4B,Wood Hydro / Light Pole,-,-,-,No
672,EXETWEL1,Exeter at Wellington EB - #672,42.9260360,-81.2151340,"Rt30, ",-,U-channel (stop specific),-,Black Ad Bench ,-,No
682,FANSADE1,Fanshawe at Adelaide EB - #682,43.0350260,-81.2540380,"Rt25, ",-,U-channel (stop specific),-,-,-,Yes
684,FANSADE4,Fanshawe west of Adelaide WB - #684,43.0347710,-81.2555420,"Rt16, Rt25, Rt92, ",-,U-channel (stop specific),4 x 8 Ad,-,Large Can (on Ground) ,Yes
688,FANSFRE1,Fanshawe east of Freemont EB - #688,43.0365370,-81.2492200,"Rt25, ",-,U-channel (stop specific),-,-,-,No
692,FANSGLE1,Fanshawe at Glengarry EB - #692,43.0373500,-81.2462300,"Rt25, ",-,Wood Hydro / Light Pole,-,-,-,No
694,FANSGLEN,Fanshawe & Glenora Dr. WB - #694,43.0396100,-81.2393900,"Rt25, ",-,U-channel (stop specific),-,-,-,No
695,FANSHAS1,Fanshawe at Hastings East EB - #695,43.0310990,-81.2671840,"Rt16, Rt25, Rt34, ",-,U-channel (stop specific),-,-,Large Can (on Ground) ,No
696,FANSHAS2,Fanshawe at Hastings WB - #696,43.0309920,-81.2681250,"Rt16, Rt19, Rt25, Rt34, ",-,U-channel (stop specific),4 x 8 Ad,-,Large Can (on Ground) ,Yes
697,FANSHAS3,Fanshawe at Hastings West EB - #697,43.0301090,-81.2705000,"Rt16, Rt19, Rt25, Rt34, ",-,U-channel (stop specific),-,-,Large Can (on Ground) ,Yes
698,FANSHIGH,Fanshawe at Highbury EB - #698,43.0429190,-81.2274960,"Rt25, ",-,Wood Hydro / Light Pole,-,Black Ad Bench ,-,No
699,FANSJEN2,Fanshawe at Jennifer 1 WB - #699,43.0300430,-81.2714230,"Rt16, Rt19, Rt25, Rt34, ",-,U-channel (stop specific),4 x 8 Ad,-,Large Can (on Ground) ,No
700,FANSJEN4,Fanshawe at Jennifer 2 WB - #700,43.0292850,-81.2739070,"Rt16, Rt19, Rt25, Rt34, Rt92, ",-,U-channel (with other signage),-,Black Ad Bench ,-,No
701,FANSLOU1,Fanshawe at Louise EB - #701,43.0244360,-81.2898790,"Rt19, ",-,U-channel (stop specific),-,Black Ad Bench ,-,No
702,FANSLOU2,Fanshawe at Louise WB - #702,43.0247130,-81.2894370,"Rt19, ",-,U-channel (stop specific),-,Black Ad Bench ,-,No
703,FANSMCLE,Fanshawe at McLean WB - #703,43.0416340,-81.2324850,"Rt25, ",-,U-channel (stop specific),-,-,-,No
704,FANSNCR1,Fanshawe west of North Centre EB - #704,43.0280570,-81.2775320,"Rt16, Rt19, Rt25, Rt34, ",-,Metal Hydro / Light Pole,4 x 8 Ad,-,-,No
705,FANSNCR2,Fanshawe west of North Centre WB - #705,43.0282390,-81.2775730,"Rt16, Rt19, Rt25, Rt34, ",-,TBD Following Construction,4 x 8 Ad,-,-,No
706,FANSNCR3,Fanshawe east of North Centre EB - #706,43.0289320,-81.2744720,"Rt16, Rt19, Rt25, Rt34, Rt92, ",-,Wood Hydro / Light Pole,4 x 8 Ad,-,Large Can (on Ground) ,Yes
707,FANSNCR4,Fanshawe east of North Centre WB - #707,43.0262760,-81.2845270,"Rt19, ",-,U-channel (stop specific),-,Black Ad Bench ,-,No
708,FANSPHIL,Fanshawe at Phillbrook WB - #708,43.0321150,-81.2644020,"Rt25, Rt34, ",-,U-channel (stop specific),4 x 8 Canopy,-,-,Yes
709,FANSRIC1,Fanshawe east of Richmond EB - #709,43.0274290,-81.2795300,"Rt16, Rt25, Rt34, ",-,TBD Following Construction,-,-,-,No
711,FANSSTO1,Fanshawe at Stoneybrook East EB - #711,43.0334090,-81.2593300,"Rt16, Rt25, ",-,Metal Hydro / Light Pole,-,Black Ad Bench ,-,No
712,FANSSTO2,Fanshawe at Stoneybrook East WB - #712,43.0337490,-81.2589550,"Rt16, Rt25, ",-,U-channel (with other signage),-,Black Ad Bench ,-,No
713,FANSSTO3,Fanshawe at Stoneybrook West EB - #713,43.0322030,-81.2634540,"Rt16, Rt25, ",-,U-channel (stop specific),-,Black Ad Bench ,-,No
717,FARRPROU,Farrah at Proudfoot EB - #717,42.9868990,-81.2898590,"Rt33, ",-,Metal Hydro / Light Pole,4 x 8 Non-Ad,-,-,No
721,FERNCONT,Ferndale at Country Club Drive WB - #721,42.9469320,-81.2520500,"Rt93, ",-,U-channel (stop specific),-,-,-,No
733,FLORASH1,Florence at Ashland EB - #733,42.9921320,-81.2075600,"Rt7, ",-,U-channel (stop specific),-,-,-,No
734,FLORASH2,Florence at Ashland WB - #734,42.9923910,-81.2071530,"Rt7, ",-,Wood Hydro / Light Pole,-,-,-,No
736,FLOREGE1,Florence at Egerton EB - #736,42.9897450,-81.2158300,"Rt7, ",-,U-channel (with other signage),-,-,-,Yes
737,FLOREGE2,Florence at Egerton WB - #737,42.9898920,-81.2158100,"Rt7, ",-,U-channel (with other signage),-,-,-,No
738,FLORELE1,Florence at Eleanor EB - #738,42.9913990,-81.2102020,"Rt7, ",-,U-channel (with other signage),-,-,-,No
739,FLORELE2,Florence at Eleanor WB - #739,42.9915060,-81.2102790,"Rt7, ",-,U-channel (stop specific),-,-,-,No
740,FLORFAI1,Florence at Fairgrounds south Gate EB - #740,42.9885830,-81.2186150,"Rt7, ",-,U-channel (stop specific),-,-,-,No
741,FLORFAI2,Florence at Fairgrounds south Gate WB - #741,42.9886380,-81.2189490,"Rt7, ",-,Metal Hydro / Light Pole,-,-,-,No
743,FLORHIG2,Florence at Highbury WB - #743,42.9941280,-81.2031910,"Rt7, ",-,U-channel (with other signage),-,-,-,No
744,FLORKEL1,Florence at Kellogg Lane EB - #744,42.9905120,-81.2133090,"Rt7, ",-,Wood Hydro / Light Pole,-,-,-,No
745,FLORKEL2,Florence at Kellogg Lane WB - #745,42.9905850,-81.2134240,"Rt7, ",-,U-channel (with other signage),-,-,-,No
750,FULLREGA,Fuller at Regal WB - #750,43.0223430,-81.2251070,"Rt10, ",-,U-channel (stop specific),-,-,-,No
752,FULLVES2,Fuller at Vesta WB - #752,43.0232280,-81.2221490,"Rt10, ",-,U-channel (with other signage),-,-,-,No
756,GAINWON1,Sherwood Forest Mall EB - #756,43.0062250,-81.3060970,"Rt9, ",-,U-channel (with other signage),4 x 8 Ad,-,-,No
757,GAINWON2,Sherwood Forest Mall WB - #757,43.0066980,-81.3049670,"Rt9, ",-,U-channel (stop specific),4 x 8 Non-Ad,-,Large Can (on Ground) ,Yes
759,GARDBER1,Gardenwood at Berkshire NB - #759,42.9629080,-81.2848620,"Rt5, Rt7, ",Rt5B,U-channel (with other signage),4 x 8 Non-Ad,-,-,No
762,GARDRID1,Gardenwood at Ridgewood EB - #762,42.9665470,-81.2836390,"Rt5, ",Rt5B,Metal Hydro / Light Pole,-,-,-,No
763,GARDRID2,Gardenwood east of Ridgewood WB - #763,42.9671440,-81.2825870,"Rt5, ",Rt5B,U-channel (with other signage),-,-,-,No
766,GARDSOU2,Gardenwood at Southcrest SB - #766,42.9648720,-81.2851580,"Rt5, ",Rt5B,Wood Hydro / Light Pole,-,-,-,No
767,GARDSOU3,57 Gardenwood NB - #767,42.9649820,-81.2851330,"Rt5, ",Rt5B,U-channel (with other signage),-,-,-,No
768,GLASMORN,Glasgow at Mornington NB - #768,43.0011140,-81.2216980,"Rt20, ",-,U-channel (with other signage),-,-,-,No
783,GOREBRAE,Gore at Braeside WB - #783,42.9784330,-81.1720810,"Rt5, ",-,U-channel (stop specific),-,-,Small Can (mounted),No
785,GOREFIRE,Gore at Firestone WB - #785,42.9792080,-81.1694340,"Rt5, ",-,U-channel (with other signage),-,-,-,No
790,GRANHIG1,Grand at High EB - #790,42.9719730,-81.2407670,"Rt6, ",-,U-channel (stop specific),-,-,-,No
791,GRANHIG2,Grand at High WB - #791,42.9721120,-81.2400400,"Rt6, ",-,U-channel (with other signage),-,-,-,No
792,GRANHIG4,84 Grand WB - #792,42.9718940,-81.2419830,"Rt6, ",-,U-channel (with other signage),-,-,-,No
800,GRENADEL,Grenfell at Adelaide WB - #800,43.0381290,-81.2561740,"Rt34, ",-,U-channel (stop specific),4 x 8 Non-Ad,-,-,No
801,GRENGREN,Grenfell at Grenfell Cr WB - #801,43.0388200,-81.2517950,"Rt34, ",-,U-channel (with other signage),-,-,-,No
803,GRENMIDA,Grenfell at Midale WB - #803,43.0404960,-81.2483110,"Rt34, ",-,U-channel (with other signage),-,-,-,No
804,GREYCOLB,Grey at Colborne WB - #804,42.9792410,-81.2365290,"Rt1, ",-,U-channel (with other signage),-,-,-,No
805,GREYWATE,Grey at Waterloo WB - #805,42.9786870,-81.2386470,"Rt1, ",-,U-channel (stop specific),-,-,-,No
808,GRIFBBA2,Griffith at Byron Baseline SB - #808,42.9518350,-81.3401180,"Rt5, ",-,Metal Hydro / Light Pole,4 x 8 Non-Ad,-,-,No
810,GRIFBOLE,Griffith at Boler EB - #810,42.9440790,-81.3293860,"Rt5, ",-,U-channel (stop specific),-,-,-,No
811,GRIFCOMM,Griffith at Commissioners SB - #811,42.9625810,-81.3427490,"Rt5, Rt17, ",Rt17A,U-channel (with other signage),-,-,Large Can (on Ground) ,No
812,GRIFDEA2,Boler Mountain SB - #812,42.9461620,-81.3362800,"Rt5, ",-,Metal Hydro / Light Pole,-,-,-,No
814,GRIFFAIR,Griffith at Fairlane SB - #814,42.9492890,-81.3389730,"Rt5, ",-,Metal Hydro / Light Pole,-,-,-,No
816,GRIFHEMO,Griffith at Helena Montague SB - #816,42.9598510,-81.3421300,"Rt5, Rt17, ",Rt17A,U-channel (stop specific),-,-,-,No
817,GRIFNORM,Griffith at Norman SB - #817,42.9562990,-81.3411900,"Rt5, Rt17, ",Rt17A,U-channel (stop specific),-,-,-,No
818,GRIFROBW,Griffith at Robinwood EB - #818,42.9422710,-81.3334180,"Rt5, ",-,Metal Hydro / Light Pole,-,-,-,No
822,GRIFWIDD,Griffith at Widdicomb SB - #822,42.9445390,-81.3358800,"Rt5, ",-,Metal Hydro / Light Pole,-,-,-,No
828,HALEBEAT,Hale at Beattie SB - #828,42.9944780,-81.1970490,"Rt2, ",Rt2A,U-channel (with other signage),-,-,-,No
829,HALEBRY1,Hale at Brydges NB - #829,42.9904900,-81.1951120,"Rt2, ",Rt2A,U-channel (stop specific),-,-,-,No
830,HALEBRY2,Hale at Brydges SB - #830,42.9908050,-81.1953210,"Rt2, ",Rt2A,U-channel (stop specific),-,-,-,No
831,HALEDOU1,Hale at Doulton NB - #831,42.9961020,-81.1977050,"Rt2, ",Rt2A,U-channel (stop specific),4 x 8 Non-Ad,-,Small Can (mounted),No
832,HALEDOU2,Hale at Burslem SB - #832,42.9965600,-81.1980600,"Rt2, ",Rt2A,U-channel (stop specific),-,-,Small Can (mounted),No
833,HALEDUND,Hale at Dundas NB - #833,42.9978360,-81.1985400,"Rt2, ",Rt2A,Wood Hydro / Light Pole,-,-,-,No
834,HALEEAST,Hale at Eastman NB - #834,42.9940410,-81.1967610,"Rt2, ",Rt2A,U-channel (stop specific),-,-,-,No
835,HALEELLS,Hale at Ellsworth SB - #835,42.9794620,-81.1909600,"Rt5, ",-,U-channel (stop specific),-,-,-,No
836,HALEGRAY,Hale at Graydon NB - #836,42.9924190,-81.1960060,"Rt2, ",Rt2A,Wood Hydro / Light Pole,-,-,-,No
837,HALEMAGE,Hale at Magee SB - #837,42.9814980,-81.1910820,"Rt5, ",-,U-channel (stop specific),-,-,-,No
838,HALEMONT,Hale at Montague Place SB - #838,42.9929160,-81.1963120,"Rt2, ",Rt2A,U-channel (with other signage),-,-,-,No
839,HALESTE1,Hale at Stevenson NB - #839,42.9881610,-81.1940230,"Rt2, ",Rt2A,U-channel (with other signage),-,-,-,No
840,HALESTE2,Hale at Stevenson SB - #840,42.9882030,-81.1941670,"Rt2, ",Rt2A,Wood Hydro / Light Pole,-,-,-,No
842,HALETRA2,Hale at Trafalgar SB - #842,42.9867560,-81.1934790,"Rt2, ",Rt2A,Wood Hydro / Light Pole,-,-,-,No
843,HALLCOMM,Halls Mills at Commissioners SB - #843,42.9607010,-81.3348380,"Rt17, ",-,Wood Hydro / Light Pole,-,Black Ad Bench ,Large Can (on Ground) ,Yes
845,HAMIADE1,Hamilton at Adelaide EB - #845,42.9819910,-81.2288310,"Rt3, Rt5, ",-,U-channel (stop specific),4 x 8 Non-Ad,-,-,No
846,HAMIADE2,Hamilton at Adelaide WB - #846,42.9820410,-81.2283280,"Rt3, Rt5, ",-,Wood Hydro / Light Pole,4 x 8 Non-Ad,-,-,No
847,HAMIBRA1,Hamilton east of Braesyde EB - #847,42.9740580,-81.1717920,"Rt3, ",-,U-channel (stop specific),-,-,-,No
848,HAMIBRA3,Hamilton west of Braesyde EB - #848,42.9748510,-81.1745270,"Rt3, ",-,Wood Hydro / Light Pole,-,-,Small Can (mounted),No
850,HAMIEAST,Hamilton at East WB - #850,42.9785800,-81.2000650,"Rt3, Rt5, ",-,U-channel (stop specific),4 x 8 Ad,-,Large Can (on Ground) ,No
851,HAMIEGE1,Hamilton at Egerton EB - #851,42.9802380,-81.2124300,"Rt3, Rt5, ",-,Metal Hydro / Light Pole,-,-,-,No
852,HAMIEGE2,Hamilton at Egerton WB - #852,42.9802850,-81.2117770,"Rt3, Rt5, ",-,U-channel (with other signage),-,-,-,No
854,HAMIELM,Hamilton at Elm WB - #854,42.9797300,-81.2082500,"Rt3, Rt5, ",-,Wood Hydro / Light Pole,-,-,-,No
855,HAMIGIL1,Hamilton at Giles EB - #855,42.9778730,-81.1959450,"Rt3, Rt5, ",-,U-channel (with other signage),-,-,Small Can (mounted),No
856,HAMIGIL2,Hamilton at Giles WB - #856,42.9779340,-81.1954340,"Rt3, Rt5, ",-,U-channel (stop specific),4 x 8 Non-Ad,-,Large Can (on Ground) ,No
858,HAMIGORE,Hamilton at Gore EB - #858,42.9754800,-81.1781240,"Rt3, ",-,U-channel (stop specific),-,-,-,No
859,HAMIHALE,Hamilton at Hale WB - #859,42.9774310,-81.1918740,"Rt3, Rt5, ",-,U-channel (stop specific),4 x 8 Canopy,-,-,No
860,HAMIHIG1,Hamilton at Highbury EB - #860,42.9774980,-81.1932150,"Rt3, Rt5, ",-,U-channel (stop specific),4 x 8 Non-Ad,-,Large Can (on Ground) ,No
861,HAMIHIG2,Hamilton at Highbury WB - #861,42.9777770,-81.1942910,"Rt3, Rt5, ",-,Wood Hydro / Light Pole,-,-,-,No
863,HAMILTGR,Hamilton at Little Grey WB - #863,42.9813380,-81.2242530,"Rt3, Rt5, ",-,Wood Hydro / Light Pole,-,-,-,No
865,HAMIMAME,Hamilton at Mamelon EB - #865,42.9813020,-81.2245680,"Rt3, Rt5, ",-,U-channel (stop specific),-,-,Small Can (mounted),No
866,HAMIMEA1,Hamilton west of Meadowlilly EB - #866,42.9767540,-81.1877440,"Rt3, ",-,Wood Hydro / Light Pole,-,-,-,No
867,HAMIMEA3,Hamilton east of Meadowlilly EB - #867,42.9765690,-81.1861350,"Rt3, ",-,U-channel (stop specific),-,-,-,No
868,HAMINORL,Hamilton at Norlan EB - #868,42.9772900,-81.1916640,"Rt3, ",-,Wood Hydro / Light Pole,-,-,-,No
871,HAMIPILA,Hamilton at Pine Lawn EB - #871,42.9784900,-81.2004800,"Rt3, Rt5, ",-,U-channel (stop specific),-,-,Small Can (mounted),No
874,HAMIREC1,Hamilton at Rectory EB - #874,42.9806200,-81.2205300,"Rt3, Rt5, ",-,U-channel (stop specific),-,-,Large Can (on Ground) ,No
875,HAMIREC2,Hamilton at Rectory WB - #875,42.9806590,-81.2200120,"Rt3, Rt5, ",-,U-channel (stop specific),-,Black Non Ad  ,-,No
878,HAMIRIRU,Hamilton at River Run Terrace EB - #878,42.9730150,-81.1682160,"Rt3, ",-,Wood Hydro / Light Pole,4 x 8 Non-Ad,-,Small Can (mounted),No
879,HAMISAC1,Hamilton at Sackville EB - #879,42.9803260,-81.2153760,"Rt3, Rt5, ",-,U-channel (with other signage),-,-,Small Can (mounted),Yes
880,HAMISAC2,Hamilton at Sackville WB - #880,42.9804380,-81.2153610,"Rt3, Rt5, ",-,Wood Hydro / Light Pole,4 x 8 Canopy,-,Large Can (on Ground) ,No
883,HAMISJU1,Hamilton at St. Julien EB - #883,42.9790800,-81.2044020,"Rt3, Rt5, ",-,Concrete Hydro / Light Pole,-,-,-,No
884,HAMISJU2,Hamilton at St. Julien WB - #884,42.9791340,-81.2040820,"Rt3, Rt5, ",-,Wood Hydro / Light Pole,-,-,Large Can (on Ground) ,No
885,HAMITENN,Hamilton at Tennyson EB - #885,42.9794700,-81.2072240,"Rt3, Rt5, ",-,U-channel (stop specific),-,-,Large Can (on Ground) ,No
887,HAMIWATM,Hamilton at Watmar EB - #887,42.9760940,-81.1825820,"Rt3, ",-,Wood Hydro / Light Pole,-,-,-,No
889,HASTCHA1,Hastings at Chambers NB - #889,43.0371340,-81.2707380,"Rt19, ",-,U-channel (stop specific),-,-,-,No
890,HASTCHA2,Hastings at Chambers SB - #890,43.0370310,-81.2707150,"Rt19, ",-,U-channel (stop specific),-,-,-,No
891,HASTDONY,Hastings at Donnybrook NB - #891,43.0320860,-81.2682320,"Rt19, ",-,Metal Hydro / Light Pole,-,-,Large Can (on Ground) ,No
892,HASTVIR1,Hastings at Virginia NB - #892,43.0340710,-81.2692680,"Rt19, ",-,Metal Hydro / Light Pole,-,-,-,No
893,HIGBBEA1,Highbury at Beattie NB - #893,42.9931700,-81.2020000,"Rt7, Rt10, ",-,U-channel (stop specific),-,-,-,No
894,HIGBBEA2,Highbury at Beattie SB - #894,42.9933096,-81.2022400,"Rt7, Rt10, ",-,Wood Hydro / Light Pole,-,-,-,No
895,HIGBBRY1,London Transit Office - #895,42.9881400,-81.1996360,"Rt10, Rt95, ",-,U-channel (stop specific),-,-,-,Yes
896,HIGBBRY2,Highbury at Brydges SB - #896,42.9877170,-81.1997670,"Rt10, Rt95, ",-,U-channel (stop specific),-,-,-,Yes
897,HIGBCALV,Highbury at Calvin SB - #897,42.9797330,-81.1957330,"Rt10, ",-,Wood Hydro / Light Pole,-,-,-,No
898,HIGBCHE1,Highbury at Cheapside NB - #898,43.0145310,-81.2124590,"Rt10, ",-,Concrete Hydro / Light Pole,-,Black Ad Bench ,-,No
899,HIGBCHE2,Highbury at Cheapside SB - #899,43.0135490,-81.2122260,"Rt10, ",-,Wood Hydro / Light Pole,-,Black Ad Bench ,-,No
900,HIGBDUN1,Highbury at Dundas NB - #900,42.9971920,-81.2037950,"Rt10, Rt95, ",-,Wood Hydro / Light Pole,4 x 12 Ad,-,Large Can (on Ground) ,Yes
901,HIGBDUN2,Highbury at Dundas SB - #901,42.9964320,-81.2037540,"Rt10, Rt95, ",-,U-channel (stop specific),4 x 8 Ad,-,Large Can (on Ground) ,Yes
903,HIGBEDVA,Highbury at Edgevalley SB - #903,43.0356010,-81.2233790,"Rt25, ",-,Metal Hydro / Light Pole,4 x 8 Non-Ad,Black Ad Bench ,Large Can (on Ground) ,No
905,HIGBFUL1,Montcalm Seconday School - #905,43.0238260,-81.2173260,"Rt10, Rt25, ",-,U-channel (stop specific),4 x 8 Non-Ad,-,-,Yes
906,HIGBFUL2,Highbury at Fuller SB - #906,43.0241900,-81.2178280,"Rt25, ",-,Concrete Hydro / Light Pole,-,Black Ad Bench ,Large Can (on Ground) ,No
907,HIGBGOD1,Highbury at Godfrey NB - #907,43.0168290,-81.2136510,"Rt10, ",-,Concrete Hydro / Light Pole,-,Black Ad Bench ,-,No
908,HIGBGOD2,Highbury at Godfrey SB - #908,43.0161250,-81.2135570,"Rt10, ",-,U-channel (with other signage),4 x 8 Non-Ad,Black Ad Bench ,-,No
909,HIGBHAM1,Highbury at Hamilton NB - #909,42.9781420,-81.1946700,"Rt10, Rt95, ",-,U-channel (stop specific),4 x 8 Ad,-,Large Can (on Ground) ,No
910,HIGBHAM2,Highbury at Hamilton SB - #910,42.9782720,-81.1950150,"Rt10, Rt95, ",-,U-channel (stop specific),4 x 8 Non-Ad,-,-,No
911,HIGBHIC1,Highbury at Hillcrest NB - #911,43.0220800,-81.2165270,"Rt10, Rt25, ",-,Wood Hydro / Light Pole,-,-,-,No
912,HIGBHIC2,Highbury at Hillcrest SB - #912,43.0218000,-81.2166400,"Rt25, ",-,U-channel (stop specific),-,Black Ad Bench ,-,No
913,HIGBHURO,Highbury at Huron NB - #913,43.0195760,-81.2151480,"Rt10, Rt15, ",-,U-channel (stop specific),-,Black Ad Bench ,-,No
914,HIGBKIAR,Highbury at Killarney SB - #914,43.0391840,-81.2251390,"Rt25, ",-,Wood Hydro / Light Pole,-,-,-,No
915,HIGBKIL2,Highbury at Kilally SB - #915,43.0316620,-81.2215360,"Rt25, ",-,Concrete Hydro / Light Pole,4 x 8 Non-Ad,Black Ad Bench ,Large Can (on Ground) ,No
916,HIGBLAN1,Robarts School - #916,43.0124180,-81.2113750,"Rt10, ",-,U-channel (stop specific),4 x 8 Ad,-,-,No
917,HIGBLAN2,Highbury at Landor SB - #917,43.0123780,-81.2116230,"Rt10, ",-,U-channel (with other signage),-,Black Ad Bench ,-,No
919,HIGBLPH1,Regional Mental Health Centre NB - #919,43.0032450,-81.2067680,"Rt10, ",-,TBD Following Construction,4 x 8 Ad,-,-,Yes
920,HIGBLPH2,Regional Mental Health Centre - #920,43.0024180,-81.2066750,"Rt10, ",-,TBD Following Construction,4 x 8 Ad,-,-,Yes
921,HIGBMAGE,Highbury at Magee NB - #921,42.9798950,-81.1956470,"Rt10, ",-,Wood Hydro / Light Pole,-,-,-,No
922,HIGBOXF1,Highbury south of Oxford NB - #922,43.0076360,-81.2089500,"Rt10, Rt95, ",-,TBD Following Construction,4 x 8 Ad,-,-,No
923,HIGBOXF2,953 Highbury - #923,43.0059340,-81.2083780,"Rt10, ",-,TBD Following Construction,-,-,-,No
924,HIGBOXF3,John Paul Seconday School - #924,43.0093160,-81.2097760,"Rt10, ",-,TBD Following Construction,-,Black Ad Bench ,-,Yes
925,HIGBOXF4,Oxbury Mall - #925,43.0077030,-81.2093140,"Rt10, Rt95, ",-,TBD Following Construction,4 x 8 Ad,-,-,Yes
926,HIGBTRA1,Highbury at Trafalgar NB - #926,42.9835420,-81.1975020,"Rt10, ",-,U-channel (stop specific),4 x 8 Non-Ad,-,-,No
927,HIGBTRA2,Highbury at Trafalgar SB - #927,42.9834780,-81.1976780,"Rt10, ",-,U-channel (stop specific),-,-,-,No
928,HIGBWIL1,Highbury at Wilton NB - #928,42.9906660,-81.2008840,"Rt7, Rt10, ",-,Wood Hydro / Light Pole,-,-,-,No
929,HIGBWIL2,Highbury at Wilton SB - #929,42.9907340,-81.2009960,"Rt7, Rt10, ",-,U-channel (stop specific),-,-,-,No
930,HIGHBASE,High at Baseline NB - #930,42.9615780,-81.2361420,"Rt6, ",-,Wood Hydro / Light Pole,-,-,-,No
931,HIGHCHE1,High at Chester NB - #931,42.9639710,-81.2368230,"Rt6, ",-,U-channel (stop specific),-,-,Small Can (mounted),No
932,HIGHCHE2,High at Chester SB - #932,42.9637610,-81.2368630,"Rt6, ",-,U-channel (stop specific),-,-,-,No
933,HIGHEME1,High at Emery NB - #933,42.9654090,-81.2371560,"Rt6, ",-,Wood Hydro / Light Pole,-,-,-,No
934,HIGHEME2,High at Emery SB - #934,42.9657760,-81.2373220,"Rt6, ",-,U-channel (stop specific),-,-,-,No
936,HIGHGRA2,High at Grand SB - #936,42.9716000,-81.2388130,"Rt6, ",-,U-channel (with other signage),-,-,-,No
937,HIGHMCL1,High at McClary NB - #937,42.9710920,-81.2385440,"Rt6, ",-,U-channel (stop specific),-,-,-,No
940,HIGHWIN2,High at Windsor Cres SB - #940,42.9687690,-81.2380340,"Rt6, ",-,U-channel (stop specific),-,-,-,No
941,HIGHWIN3,High at Windsor Cres NB - #941,42.9686280,-81.2379280,"Rt6, ",-,U-channel (with other signage),-,-,-,No
943,HIGVFER1,Highview at Ferndale NB - #943,42.9478000,-81.2556080,"Rt93, ",-,U-channel (with other signage),-,-,-,No
944,HIGVFER2,Highview at Ferndale SB - #944,42.9479500,-81.2557270,"Rt93, ",-,Metal Hydro / Light Pole,-,-,-,No
945,HIGVROS1,Highview at Rossmore Crt NB - #945,42.9527470,-81.2555220,"Rt93, ",-,U-channel (stop specific),4 x 8 Non-Ad,-,-,No
946,HIGVROS2,Highview at Rossmore Crt SB - #946,42.9528590,-81.2555980,"Rt93, ",-,Metal Hydro / Light Pole,-,-,-,No
947,HIGVROS3,Highview at Rossmore Place NB - #947,42.9504560,-81.2551030,"Rt93, ",-,U-channel (stop specific),-,-,-,No
948,HIGVROS4,Highview at Rossmore Place SB - #948,42.9503520,-81.2551940,"Rt93, ",-,Metal Hydro / Light Pole,-,-,-,No
949,HIGVWHA1,Highview at Wharncliffe EB - #949,42.9537930,-81.2592680,"Rt93, ",-,Metal Hydro / Light Pole,-,-,-,No
950,HIGVWHA2,90 Highview - #950,42.9540230,-81.2569690,"Rt93, ",-,U-channel (stop specific),4 x 8 Non-Ad,-,-,No
951,HIGVWHA4,Highview at Wharncliffe WB - #951,42.9538830,-81.2588790,"Rt93, ",-,U-channel (stop specific),4 x 8 Non-Ad,-,Large Can (on Ground) ,No
954,HOLIEXET,Holiday at Exeter SB - #954,42.9264120,-81.2188620,"Rt13, ",Rt13X,U-channel (stop specific),-,-,-,No
955,HOLIGREE,Holiday at Greenfield SB - #955,42.9283430,-81.2193160,"Rt13, ",Rt13X,U-channel (with other signage),-,-,Small Can (mounted),No
966,HORTHAMI,Horton at Hamilton WB - #966,42.9827270,-81.2338410,"Rt3, Rt5, ",-,U-channel (with other signage),-,-,-,No
967,HORTMAIT,Horton at Maitland EB - #967,42.9824110,-81.2345690,"Rt3, Rt5, ",-,Wood Hydro / Light Pole,-,-,-,No
969,HORTRIC2,Horton at Richmond WB - #969,42.9789400,-81.2479750,"Rt4, Rt15, Rt104, ",-,U-channel (stop specific),-,-,-,Yes
970,HORTRID1,Horton at Ridout EB - #970,42.9778250,-81.2510080,"Rt4, Rt15, ",-,U-channel (with other signage),-,-,Large Can (on Ground) ,No
977,HORTWAT2,Horton at Waterloo WB - #977,42.9811010,-81.2398380,"Rt3, Rt5, ",-,U-channel (with other signage),-,-,-,No
978,HORTWELL,Horton at Wellington EB - #978,42.9803510,-81.2420120,"Rt1, Rt3, Rt5, ",-,TBD Following Construction,4 x 8 Non-Ad,-,-,No
980,HORTWHA2,Horton west of Wharncliffe WB - #980,42.9768190,-81.2630140,"Rt5, ",-,Wood Hydro / Light Pole,-,Black Ad Bench ,-,Yes
981,HORTWHA3,Horton west of Wharncliffe EB - #981,42.9765690,-81.2649390,"Rt5, ",-,Wood Hydro / Light Pole,-,-,-,No
982,HORTWHA4,Horton west of Wharncliffe 2 WB - #982,42.9766700,-81.2652730,"Rt5, ",-,Wood Hydro / Light Pole,-,-,-,No
988,HUBRENT4,Hubrey at Enterprise south SB - #988,42.9304740,-81.1838040,"Rt30, ",-,Wood Hydro / Light Pole,-,-,-,No
989,HUBRWIL2,Hubrey at Wilton Grove SB - #989,42.9293750,-81.1831080,"Rt30, ",-,Wood Hydro / Light Pole,-,-,-,No
990,HUDSBAFF,Hudson at Baffin Place EB - #990,42.9918180,-81.1584400,"Rt2, ",Rt2A,Metal Hydro / Light Pole,-,-,-,No
